{
  "schema_version": "1.0",
  "project_id": "fabian-portfolio",
  "run_id": "RUN-20260902231838",
  "epic_id": "EPIC-004",
  "state": "running",
  "phase": "architecture",
  "current_round": "ROUND-001",
  "current_ticket": "TICKET-001",
  "rounds": [
    {
      "round_id": "ROUND-001",
      "status": "in_progress",
      "tickets": [
        {
          "ticket_id": "TICKET-001",
          "dependencies": [],
          "planning": {
            "status": "passed",
            "attempts": 1,
            "artifact": "harness/runs/RUN-20260902231838/ROUND-001/planner.output.json"
          },
          "architecture": {
            "status": "not_started",
            "attempts": 0,
            "artifact": null
          },
          "implementation": {
            "status": "not_started",
            "attempts": 0,
            "artifact": null
          },
          "review": {
            "status": "not_started",
            "attempts": 0,
            "artifact": null
          },
          "tests": {
            "status": "not_started",
            "attempts": 0,
            "artifact": null
          },
          "documentation": {
            "status": "not_started",
            "attempts": 0,
            "artifact": null
          },
          "merge": {
            "status": "not_started",
            "attempts": 0,
            "artifact": null
          }
        },
        {
          "ticket_id": "TICKET-002",
          "dependencies": [
            "TICKET-001"
          ],
          "planning": {
            "status": "passed",
            "attempts": 1,
            "artifact": "harness/runs/RUN-20260902231838/ROUND-001/planner.output.json"
          },
          "architecture": {
            "status": "not_started",
            "attempts": 0,
            "artifact": null
          },
          "implementation": {
            "status": "not_started",
            "attempts": 0,
            "artifact": null
          },
          "review": {
            "status": "not_started",
            "attempts": 0,
            "artifact": null
          },
          "tests": {
            "status": "not_started",
            "attempts": 0,
            "artifact": null
          },
          "documentation": {
            "status": "not_started",
            "attempts": 0,
            "artifact": null
          },
          "merge": {
            "status": "not_started",
            "attempts": 0,
            "artifact": null
          }
        },
        {
          "ticket_id": "TICKET-003",
          "dependencies": [
            "TICKET-002"
          ],
          "planning": {
            "status": "passed",
            "attempts": 1,
            "artifact": "harness/runs/RUN-20260902231838/ROUND-001/planner.output.json"
          },
          "architecture": {
            "status": "not_started",
            "attempts": 0,
            "artifact": null
          },
          "implementation": {
            "status": "not_started",
            "attempts": 0,
            "artifact": null
          },
          "review": {
            "status": "not_started",
            "attempts": 0,
            "artifact": null
          },
          "tests": {
            "status": "not_started",
            "attempts": 0,
            "artifact": null
          },
          "documentation": {
            "status": "not_started",
            "attempts": 0,
            "artifact": null
          },
          "merge": {
            "status": "not_started",
            "attempts": 0,
            "artifact": null
          }
        },
        {
          "ticket_id": "TICKET-004",
          "dependencies": [
            "TICKET-003"
          ],
          "planning": {
            "status": "passed",
            "attempts": 1,
            "artifact": "harness/runs/RUN-20260902231838/ROUND-001/planner.output.json"
          },
          "architecture": {
            "status": "not_started",
            "attempts": 0,
            "artifact": null
          },
          "implementation": {
            "status": "not_started",
            "attempts": 0,
            "artifact": null
          },
          "review": {
            "status": "not_started",
            "attempts": 0,
            "artifact": null
          },
          "tests": {
            "status": "not_started",
            "attempts": 0,
            "artifact": null
          },
          "documentation": {
            "status": "not_started",
            "attempts": 0,
            "artifact": null
          },
          "merge": {
            "status": "not_started",
            "attempts": 0,
            "artifact": null
          }
        },
        {
          "ticket_id": "TICKET-005",
          "dependencies": [
            "TICKET-001",
            "TICKET-002",
            "TICKET-003",
            "TICKET-004"
          ],
          "planning": {
            "status": "passed",
            "attempts": 1,
            "artifact": "harness/runs/RUN-20260902231838/ROUND-001/planner.output.json"
          },
          "architecture": {
            "status": "not_started",
            "attempts": 0,
            "artifact": null
          },
          "implementation": {
            "status": "not_started",
            "attempts": 0,
            "artifact": null
          },
          "review": {
            "status": "not_started",
            "attempts": 0,
            "artifact": null
          },
          "tests": {
            "status": "not_started",
            "attempts": 0,
            "artifact": null
          },
          "documentation": {
            "status": "not_started",
            "attempts": 0,
            "artifact": null
          },
          "merge": {
            "status": "not_started",
            "attempts": 0,
            "artifact": null
          }
        }
      ]
    }
  ],
  "checkpoint": {
    "resume_from": "Run Architect for TICKET-001",
    "last_validated_artifact": "harness/runs/RUN-20260902231838/ROUND-001/planner.output.json",
    "last_completed_phase": "planning",
    "saved_at": "2026-09-02T23:51:46.000Z"
  },
  "errors": [],
  "updated_at": "2026-09-02T23:51:46.000Z"
}
